[
  {
    "id": "layer-earthquakes",
    "name": "Recent Earthquakes",
    "datasetIds": [
      "ds-earthquakes-recent"
    ],
    "format": "geojson",
    "category": "Scientific",
    "confidence": "Official",
    "refreshFrequency": "Hourly",
    "enabled": true,
    "visualization": {
      "type": "circle",
      "paint": {
        "circle-color": "#e74c3c",
        "circle-radius": [
          "*",
          [
            "get",
            "mag"
          ],
          2
        ]
      }
    }
  },
  {
    "id": "layer-funvisis",
    "name": "FUNVISIS Local Earthquakes",
    "datasetIds": [
      "dataset-funvisis-earthquakes"
    ],
    "category": "Scientific",
    "confidence": "Official",
    "refreshFrequency": "Static",
    "enabled": false,
    "visualization": {
      "type": "points",
      "color": "#3498db"
    }
  },
  {
    "id": "layer-faults",
    "name": "Tectonic Faults",
    "datasetIds": [
      "dataset-faults"
    ],
    "category": "Scientific",
    "confidence": "Official",
    "refreshFrequency": "Static",
    "enabled": false,
    "visualization": {
      "type": "line",
      "color": "#f1c40f"
    }
  },
  {
    "id": "layer-geologic-units",
    "name": "USGS Geologic Units",
    "datasetIds": [
      "ds-usgs-geologic-units"
    ],
    "category": "Scientific",
    "confidence": "Official",
    "refreshFrequency": "Static",
    "enabled": false,
    "visualization": {
      "type": "fill",
      "color": "#95a5a6"
    }
  },
  {
    "id": "layer-sat-before",
    "name": "Esri World Imagery (Before)",
    "datasetIds": [
      "ds-satellite-before"
    ],
    "category": "Scientific",
    "confidence": "Official",
    "refreshFrequency": "Static",
    "enabled": false,
    "visualization": {
      "type": "raster",
      "url": "https://server.arcgisonline.com/ArcGIS/rest/services/World_Imagery/MapServer/tile/{z}/{y}/{x}"
    }
  },
  {
    "id": "layer-copernicus-damage",
    "name": "Copernicus Damage Assessment",
    "datasetIds": [
      "ds-copernicus-buildings",
      "ds-copernicus-roads"
    ],
    "category": "Scientific",
    "confidence": "Official",
    "refreshFrequency": "Static",
    "enabled": false,
    "visualization": {
      "type": "mixed"
    }
  },
  {
    "id": "layer-copernicus-ground-movement",
    "name": "Copernicus Ground Movement",
    "datasetIds": [
      "ds-copernicus-ground-movement"
    ],
    "category": "Scientific",
    "confidence": "Official",
    "refreshFrequency": "Static",
    "enabled": false,
    "visualization": {
      "type": "fill"
    }
  },
  {
    "id": "layer-nasa-sentinel-damage",
    "name": "NASA Sentinel Damage Map",
    "datasetIds": [
      "ds-nasa-sentinel-damage"
    ],
    "category": "Scientific",
    "confidence": "Official",
    "refreshFrequency": "Static",
    "enabled": false,
    "visualization": {
      "type": "fill"
    }
  },
  {
    "id": "layer-nasa-interferogram",
    "name": "NASA Unwrapped Interferogram",
    "datasetIds": [
      "ds-nasa-interferogram"
    ],
    "category": "Scientific",
    "confidence": "Official",
    "refreshFrequency": "Static",
    "enabled": false,
    "visualization": {
      "type": "raster",
      "url": "https://tiledimageservices7.arcgis.com/WSiUmUhlFx4CtMBB/arcgis/rest/services/202610_sentinel1_unwrappedInterferogram/ImageServer/tile/{z}/{y}/{x}"
    }
  },
  {
    "id": "layer-verified-buildings",
    "name": {
      "en": "Field-Verified Buildings (TerremotoVenezuela)",
      "es": "Edificios Verificados en Terreno (TerremotoVenezuela)"
    },
    "datasetIds": [],
    "category": "Humanitarian",
    "confidence": "Official",
    "refreshFrequency": "Real-time",
    "enabled": false,
    "visualization": {
      "type": "point",
      "color": "#f39c12"
    }
  }
]